'Unsere Geschichte beginnt auf einer prachtvollen Brücke!\nEin Junge begegnet einem wunderschönen Mädchen, das über das Wasser blickt, und sie verlieben sich ineinander!\n\nSein Name ist Romeo, vom Haus Montague!\nIhrer ist Julia, vom Haus Capulet!\n\nLeider besteht zwischen ihren Familien seit Generationen eine Fehde!'
'Oh Romeo, Romeo! Warum nur, Romeo? Verleugne deinen Vater, deinen Namen!\n\nOder, wenn du willst, lege ich den meinen ab.'
"'Nenn mich Liebe, Julia!\n\nDenn was ist ein Name? Was uns Rose heißt; wie es auch hieße, würde ebenso lieblich duften.'"
'Oh, ich liebe dich, mein Romeo!'
'Und ich, dich, auf ewig ... Bis der Tod kommt!'
'Nein, Romeo ...\n\nDu musst leben! Mit mir ... bis die Zeit selbst abläuft!'
'Aber die Sterne hecken Pläne aus. Ein unglücklicher Messerstich oder zwei stürzen die Beziehungen zwischen den Familien in ein neues Tief.\n\nEin demütiger Geistlicher, Bruder Lorenzo, hat Mitleid mit den beiden und unterbreitet Julia eine Intrige.'
'Bruder Lorenzo, ich soll einen Mann heiraten, den ich nicht liebe.\n\nGibt es kein Entkommen? Keine List, die mich und Romeo zusammenbringen kann?'
'Nimm dieses Fläschchen und trinke daraus. Zweiundvierzig Stunden wirst du steif und starr und kalt wie der Tod erscheinen.\n\nFindest du den Mut, dann wirst du auferstehen, nachdem du in die Gruft getragen, und triffst deinen Romeo.'
'Gib es her, gib es her! Oh, erzähle nichts von Furcht!\nAls ob Furcht mich trennen könnte von Romeo! Ha! Gahahaha!'
'Doch ach! Der Brief, der Romeo von diesem Plan berichten sollte, ging dem Boten verloren.\nDem armen Burschen mangelte es an Herausforderungen!\n\nNachdem Julias Diener Balthasar Romeo über ihren Tod unterrichtet, schleicht er, von Trauer übermannt, in die Familiengruft.'
'Oh, meine Liebe! Der Tod hat noch keine Macht über deine Schönheit.\n\nUnd doch werde ich nie mehr in diese tiefen Teiche blicken, die deine Augen sind.'
'So sterbe ich also mit einem Kuss. Mögen wir uns in einer Welt wiedersehen, die vom Streit unberührt ist.\n\nIch trinke auf meine Liebe!'
'In seine Trauer nimmt Romeo ein tödliches Gift und haucht seinen letzten Atemzug.\n\nErst dann erwacht Julia.'
'Romeo? Es kann nicht sein!\n\nVon mir genommen, warum nur? Oh Böser!'
'Soll ich nie mehr meinen Namen von deinen Lippen hören?\n\nDoch jetzt können wir zusammen sein ...'
'Bald darauf erfuhren die streitenden Familien vom Tod der jungen Liebenden. Und obwohl die Tragödie der Fehde ein Ende setzte, sollten Romeo und Julia nie etwas davon erfahren. \n\nJa ... ein trauriges Ende zu einer traurigen Geschichte. Einfach dahingeflossen ... Versteht ihr? „Flosse?“ Gah ha ha!'
''
''
''
