'Ähm ... Vor langer, langer Zeit! Da lebte ein wunderschönes und gütiges Mädchen namens Aschenputtel.'
'Oh, Mutter ...'
'Nachdem Aschenputtels Mutter gestorben war, zog die neue Frau ihres Vaters mit ihren Töchtern in ihr Haus.\n\nAber Aschenputtels Stiefmutter war grausam, und ihre Stiefschwestern waren eifersüchtig auf die Schönheit des Mädchens.'
'Aschenputtel! R... R... Räume sofort fertig auf! Und dann kannst du das Geschirr spülen!\n\nEs gibt viel zu tun, und ich dulde deine Faulheit nicht!'
'Igitt, SIEH dir die schmutzigen Kleider an. Aber für eine Küchenmagd wie dich passen sie perfekt.'
'Sch... Sch... Schmutziges, schmutziges Aschenputtel! Voller Asche und Staub!'
'Eines Tages verkündete der Prinz des Königreichs, dass er einen Ball geben wollte.\n\nAschenputtels Stiefmutter und ihre Stiefschwestern nahmen in ihren schönsten Kleidern teil, aber sie weigerten sich, das arme Mädchen mitzunehmen.\n\nVor den Augen des weinenden Kindes erschien eine Fee.'
'Weine nicht, Aschenputtel.\nLächle für mich und ich werde dich mit Magie belohnen!\n\nAbrakadabra ... Simsala Bim! \n\nSo! Ein Kleid, eine Kürbiskutsche und Mäuse als Kutscher. Und jetzt ab mit dir auf den Ball!'
'Großartig! Vielen Dank, danke!'
'Aber vergiss nicht, Aschenputtel: Die Magie lässt nach, wenn die Uhr Mitternacht schlägt. Du musst vorher nach Hause zurückkehren.'
'Und damit gab die Fee Aschenputtel ihr letztes Geschenk: ein Paar gläserner Schuhe.\n\nAschenputtel war auf dem Ball der Mittelpunkt. Selbst der Prinz war von ihrer Schönheit verzaubert.'
'Das hat SO VIEL SPAẞ gemacht! Aber ... es IST beinahe Mitternacht, also sollte ich los.'
'Du da! Wunderschöne Dame! Bitte warte!'
'Der Prinz hob den gläsernen Schuh auf und schwor sich, die junge Frau zu finden, der er gehörte.'
'Das ist mein Schuh. Er wird sicherlich ... uff, passen!'
'Du musst dafür SORGEN, dass er passt, mein Schatz!'
'Aber keine der grausamen Stiefschwestern bekam den Schuh an ihren Fuß.'
'Es kann nicht sein, dass Aschenputtel in diesen schmutzigen Lumpen auf dem Ball war! Schmutziges, schmutziges Aschenputtel!'
'Aber sieh da! Als Aschenputtel den Schuh anprobierte, passte er wie angegossen.\n\nUnd so vermählten sich Aschenputtel und der Prinz, und sie lebten glücklich und zufrieden, bis an ihr Lebensende. ... Oh! E... Ende!'
''
