'Es war einmal ein Mädchen mit einem so schönen Gesicht und einem so gütigen Herzen, dass niemand ihrer Schönheit gleichkommen konnte. Der Name des Mädchens was Aschenputtel.'
'Oh, Mutter ...'
'Nachdem Aschenputtels Mutter gestorben war, zog die neue Frau ihres Vaters mit ihren Töchtern in ihr Haus.\n\nAber Aschenputtels Stiefmutter war über die Jahre der Einsamkeit bitter geworden, und ihre Stiefschwestern waren eifersüchtig auf die Schönheit des Mädchens. \n\nWie es mich schmerzt, so viele so unglückliche Frauen zu sehen ...'
'Aschenputtel? Aschenputtel! Räume sofort fertig auf! Und dann kannst du das Geschirr spülen!\n\nEs gibt viel zu tun, und ich dulde deine Faulheit nicht!'
'Sieh dich an ... Sieh dich nur an! Komplett in Staub und Asche gehüllt! Aber dieser Dreck ist vielleicht die beste Garderobe, auf die du hoffen könntest, was?'
'Dreckiges, staubiges Aschenputtel! Von Kopf bis Fuß schmutzig!'
'Ja, Aschenputtel hatte keine andere Wahl, als weiter zu leiden, bis eines Tages der Prinz verkündete, dass er einen Ball geben wollte!\n\nDoch obwohl Aschenputtels Stiefmutter und ihre Stiefschwestern teilnahmen, weigerten sie sich, Aschenputtel mitzunehmen.\n\nVor den Augen des weinenden Kindes erschien eine Fee.'
'Kopf hoch, Aschenputtel.\n\n Ich gebe dir ein höchst elegantes Kleid und eine Kürbiskutsche mit Mäusen als Kutscher. Dann kannst AUCH DU auf den Ball gehen!'
'Fabelhaft! Vielen Dank, danke!'
'Aber vergiss nicht, Aschenputtel: Die Magie lässt nach, wenn die Uhr Mitternacht schlägt. \n\nDu <i>musst</i> vorher nach Hause zurückkehren.'
'Schließlich gab die Fee Aschenputtel noch ein Abschiedsgeschenk: ein wunderschönes Paar gläserner Schuhe.\n\nUnd damit machte sich Aschenputtel auf den Weg zum Ball! \n\nDurch ihre Ausstrahlung von Eleganz und Kultiviertheit zog sie die Blicke aller auf sich, auch den eines bestimmten Prinzen ...'
'Oh, welch eine Freude! Aber leider nähert sich die Mitternachtsstunde! Ich muss gehen ...'
'Warte, schönes Mädchen! Bitte! Oh, gewähre mir doch noch einen weiteren Moment, um dich zu betrachten ... Hahh ... In der Nacht verschwunden ...'
'Der Prinz hob den gläsernen Schuh auf und schwor sich, die junge Frau zu finden, der er gehörte.'
'Das ist mein Schuh. Er wird sicherlich ... uff, passen!'
'Ja, ja, du musst dafür SORGEN, dass er passt, mein Schatz!'
'Aber keine der grausamen Stiefschwestern bekam den Schuh an ihren Fuß.'
'Es ist undenkbar, dass Aschenputtel in diesen schmutzigen Lumpen auf dem Ball war! Der Schuh wäre an ihren stinkenden Füßen verschwendet!'
'Aber sieh da! Als Aschenputtel den Schuh anprobierte, passte er wie angegossen.\n\nUnd so vermählten sich Aschenputtel und der Prinz, und sie lebten und liebten glücklich und zufrieden, bis an ihr Lebensende.'
''
