'Nowa! Sie sagten, du wärst hier! Oh, ich war krank vor Sorge um dich!'
'Nun, jetzt da ich dich mit eigenen Augen putzmunter sehe, habe ich SO viele Neuigkeiten von zu Hause!'
'Erinnerst du dich an Nolla aus dem Haus hinter uns? Nun, sie hat ein Kind gekriegt und meine Güte, war das ein Wirbel!'
'Das ganze Dorf hat gefeiert – es erinnerte mich gleich an damals, als du und Leene geboren wurdet! Ah, Erinnerungen ...'
'Leider hast du es verpasst, vergiss bitte nicht, bei ihr vorbeizuschauen und beim nächsten Besuch Glück zu wünschen. Gute Manieren sind das!'
'Tante Martha, du bist hier, ich glaube es nicht! Wie geht es dem Dorf?!'
'Oh, die Reparaturen gehen voran, keine Sorge.'
'Du weißt doch, wie geschickt Aless immer war, ja? Nun, er bringt in Windeseile alles wieder auf Vordermann. Der Mann ist eine Naturgewalt!'
'Oh und Milly! Du erinnerst dich an Milly, ja? Das kleine Schätzchen ist ganz erwachsen und soll an jemandem großen Gefallen gefunden haben!'
'Ist ja nur richtig, wenn wir die beiden verkuppeln. Kennst du hier Leute, die bei der Sache helfen könnten?'
'Ähmmm ...'
'Oh, und was erzählen die Leute, du wärst jetzt irgendein großer Anführer? Mein kleiner Nowa steigt auf in der Welt!'
'Nun, du wirst wirklich jede Hilfe brauchen und deshalb habe ich mich entschieden, hier auf dem Bauernhof zu helfen. Mit leerem Magen kämpft es sich schlecht.'
'Tantchen, bitte. Immer langsam. Ich kann nicht ...'
'Na, na, na! Kein weiteres Wort von dir, mein Junge! Von diesem Tag an werde ich ebenfalls meine Schuldigkeit tun!'
'Oh und wenn du DICH für aufdringlich hältst, warte nur, bis du den Tisch unter meinen ganzen Leckereien ächzen hörst!'
'Nun, genug geplaudert. Wo versteckst du deine Geräte? Ich brauche Saatgut, Gießkanne, Schubkarren, etwas Faden ...'
'Jawohl, Zeit, die Ärmel hochzukrempeln! Jetzt zurück an die Arbeit mit dir, Nowa. Tu wegen mir nicht so, als hättest du nichts zu tun!'
'Nowa! Leene! Sie sagten, ihr beiden wärt hier! Oh, ich war krank vor Sorge um euch!'
'Nun, jetzt da ich euch beide mit eigenen Augen putzmunter sehe, habe ich SO viele Neuigkeiten von zu Hause!'
'Erinnerst du dich an Nolla aus dem Haus hinter uns? Nun, sie hat ein Kind gekriegt und meine Güte, war das ein Wirbel!'
'Das ganze Dorf hat gefeiert – es erinnerte mich gleich an damals, als ihr beide geboren wurdet! Ah, Erinnerungen ...'
'Leider hast du es verpasst, vergiss bitte nicht, bei ihr vorbeizuschauen und beim nächsten Besuch Glück zu wünschen. Gute Manieren sind das!'
'Tante Martha!'
'Tantchen, du bist hier, ich glaube es nicht! Wie geht es dem Dorf?!'
'Oh, die Reparaturen gehen voran, keine Sorge.'
'Du weißt doch, wie geschickt Aless immer war, ja? Nun, er bringt in Windeseile alles wieder auf Vordermann. Der Mann ist eine Naturgewalt!'
'Oh und Milly! Du erinnerst dich an Milly, ja? Das kleine Schätzchen ist ganz erwachsen und soll an jemandem großen Gefallen gefunden haben!'
'Ist ja nur richtig, wenn wir die beiden verkuppeln. Kennst du hier Leute, die bei der Sache helfen könnten?'
'Ähmmm ...'
'Ha! Für so was ist Nowa mal ÜBERHAUPT nicht die richtige Person.'
'Oh und was erzählen die Leute, du wärst jetzt irgendein großer Anführer? Mein kleiner Nowa steigt auf in der Welt!'
'Nun, du wirst wirklich jede Hilfe brauchen und deshalb habe ich mich entschieden, hier auf dem Bauernhof zu helfen. Mit leerem Magen kämpft es sich schlecht.'
'Tantchen, bitte. Immer langsam. Ich kann nicht ...'
'Na, na, na! Kein weiteres Wort von dir, mein Junge! Von diesem Tag an werde ich ebenfalls meine Schuldigkeit tun!'
'Oh und wenn du DICH für aufdringlich hältst, warte nur, bis du den Tisch unter meinen ganzen Leckereien ächzen hörst!'
'Juhuu! Tante Martha bleibt bei uns!'
'Ich könnte auch vor Freude springen, Liebling.'
'Nun, genug geplaudert. Wo versteckst du deine Geräte? Ich brauche Saatgut, Gießkanne, Schubkarren, etwas Faden ...'
'Jawohl, Zeit, die Ärmel hochzukrempeln! Jetzt zurück an die Arbeit mit euch beiden. Tut wegen mir nicht so, als hättet ihr nichts zu tun!'
'Ja, Madam!'
