'*Seufz* Kann ich helfen, junger Mann?'
'Ja, tatsächlich. Ich suche nach neuen Kameraden – nicht unbedingt Kämpfern, aber Leuten, die etwas zu unserer Stadt beitragen und sie zu einem besseren Ort machen können.'
'Dann brauchst du wohl ein Theater. Einen Ort, an dem man Theaterstücke und dergleichen aufführen kann.'
'Das Theater war meine Bestimmung, damals ... aber wehe mir, ich fürchte, meine Leidenschaft ist wie ein nasser Lappen aus mir herausgewrungen worden.'
'Dieser Tage bin ich völlig unqualifiziert, auch nur einen Fuß in die Nähe einer Bühne zu setzen.'
'Vielleicht ... wenn ich nur das richtige Stück finden würde, ein Drehbuch, das mich am Herzen packt und nicht mehr loslässt ...'
'Hm? Du hast da ein Drehbuch, oder? Dürfte ich mir das ansehen?'
'Natürlich, gerne.'
'Vielen Dank. Hmm, mal sehen ... Es heißt <i>Liebe unter einem schlechten Stern</i> ... Ja ... Oje ... *Keuch*'
'Es ist wunderschön. Eine Geschichte von höchstem Wert!'
'Ja?'
'Ach, ich könnte weinen! Seit Jahren war ich nicht mehr so gerührt – und wenn ich mir vorstelle, dass du mit diesem Meisterwerk in der Hand direkt auf mich zukamst ... Das kann nur Schicksal sein.'
'Dann müssen die Tücken <i>deines</i> Lebens eine ganz eigene, spannende Geschichte sein.'
'Ähhh ... wenn du es sagst?'
'Es ist offensichtlich, junger Mann, dass wir einander begegnen sollten – zwei Figuren, die sich eine Szene im großen Szenario der Welt teilen.'
'Es schien mir, als würde ich nie wieder im Theater arbeiten, aber jetzt höre ich, wie die höheren Mächte in donnernden Tönen rufen: „Die Show muss weitergehen!“'
'Du sprachst davon, dass du auf der Suche nach Mitstreitern bist. Dürfte ich mit deiner Erlaubnis in deiner Stadt ein Theater errichten und als Intendant arbeiten?'
'Ausgezeichnet! Ich bin Clarke, und ich werde dich zum Staunen bringen! Ich beschere dir Größe! Ich werde dich mit flüchtigen Träumen verblüffen! Die Show WIRD weitergehen!'
'Oh. Nun, ich schätze, es war eine unerwartete Bitte. Komm zu mir, wenn du meinst, dass deine Stadt bereit ist. '
'Möchtest du mich zu deinem Intendanten machen?'
'Tja, ich bin eben doch nicht aus Stein. Eine <i>leidenschaftliche</i> Geschichte könnte genau das sein, was ich brauche, um meine Liebe zum Theater wieder zu entfachen.'
'Doch heute muss ich dich bitten, mir meine Ruhe zu lassen. Wenn das Schicksal es so will, dann werden sich unsere Wege wieder kreuzen.'
'Ich bräuchte ein Drehbuch, das so leidenschaftlich ist, dass ich meine Liebe zum Theater erneut entfachen kann.'
'Wie ich sehe, hast du eins dabei, aber ...'
'Ich glaube nicht, dass mich dieses Stück ansprechen wird. Es tut mir leid.'
'Das Drehbuch, das ich suche, muss <i>leidenschaftlich</i> sein.'
'Ah, hallo, junger Mann. So sieht man sich wieder. Ist das ein Drehbuch, das du mir mitgebracht hast? Darf ich?'
'Das hier ist richtig, da bin ich mir sicher!'
