'Was willst DU denn, Kleiner? Siehst du nicht, dass ich arbeite?'
'Ah! Schau an, wer es ist. Du bist der Grünschnabel aus der Allianz, der in aller Munde ist. „Sein Bergwerk hat das beste Erz!“ Schnaub!'
'Die Leute sagen das? Danke.'
'Dein Glück, dass ich unberechenbar bin! Mich langweilt’s, immer wieder die gleichen Adern abzubauen. Willste mich einstellen?'
'Ich werde der beste verdammte Gildenvertreter sein, den ihr je hattet, oder ihr bekommt euer Geld zurück – natürlich nur, wenn ihr interessante Arbeit für mich habt.'
'Schnell und entschlossen! Gefällt mir! Ich bin Durlan und jeder kennt mich hier.'
'Gebt mir etwas zu tun – und sorgt dafür, dass der Alkohol nicht ausgeht – dann bin ich besser als alle jungen Kerle da draußen!'
'Ich bringe euch so viel Erz, ihr glaubt, es sei ein Scherz! Seht ihr? Bergbau <i>und</i> dazu noch ein Reimtalent. Ga ha ha ha!'
'Was?! Hey, ihr versteht keinen Spaß. Euer Bergwerk ist verlockend, aber nur zu! Rümpft eure Nase über das Angebot.'
'Ich werde hier schuften, wenn ihr eure Meinung ändert.'
'Ah, wer kommt da denn? Ihr wollt mich doch einstellen, nicht?'
'Was willst DU denn, Kleiner? Siehst du nicht, dass ich arbeite?'
'Oh. T... Tut mir leid, mein Herr.'
'Hm. Wenigstens hast du Manieren. Sag mal, bist du nicht dieser Grünschnabel von der Allianz, von dem alle reden?'
'Ich habe gehört, ihr habt eine Gilde gegründet. Ich wette, ihr bereut es, euch das zugemutet zu haben! Trotzdem, macht weiter so. Vielleicht werde ich eines Tages für euch arbeiten, wenn es sich für mich lohnt.'
'Wirklich?'
'Wie sehe ich aus? Wie ein verdammter Lügner? Egal, ich sagte, „wenn“. Ich bin erst mal zufrieden mit diesem Bergwerk hier. '
'Versuch’s doch später noch mal, dann sage ich vielleicht etwas anderes.'
'Nun, wen haben wir denn da? Wirst du nicht langsam müde vom Herumlaufen? Setz dich, mein Junge. Ich mache dir einen Tee. '
'Danke.'
'Vorhin bin ich auf das FASZINIERENDSTE Erz gestoßen. Ich glaube, ich bleibe noch ein bisschen länger in diesem Bergwerk.'
'Oder zumindest bis du und deine Gilde mir ein interessantes Angebot macht.'
'Ich werde erst mal hier bleiben. Versuch’s doch später noch mal, dann sage ich vielleicht etwas anderes.'
'Ah! Genau der junge Mann, auf den ich gewartet habe! Dieses Bergwerk geht mir langsam auf die Nerven.'
'Aber ich habe gehört, eure Gilde floriert wirklich außerordentlich. Könnte ich euch nicht überzeugen, mich als Vertreter einzustellen?'
'Ihr findet keinen fleißigeren Arbeiter – sonst gibt es das Geld zurück!'
'Schnell und entschlossen! Gefällt mir! Ich bin Durlan und jeder kennt mich hier.'
'Gebt mir etwas zu tun – und sorgt dafür, dass der Alkohol nicht ausgeht – dann bin ich besser als alle jungen Kerle da draußen!'
'Ich bringe euch so viel Erz, ihr glaubt, es sei ein Scherz! Seht ihr? Bergbau <i>und</i> dazu noch ein Reimtalent. Ga ha ha ha!'
'Was?! Hey, ihr versteht keinen Spaß. Euer Bergwerk ist verlockend, aber nur zu! Rümpft eure Nase über das Angebot.'
'Ich werde hier schuften, wenn ihr eure Meinung ändert.'
'Ah, wer kommt da denn? Ihr wollt mich doch einstellen, nicht?'
